The Simpsons Movie;6.999;Animation;2007;David Silverman;images\35.jpg;After Homer accidentally pollutes the town's water supply, Springfield is encased in a gigantic dome by the EPA and the Simpsons are declared fugitives.;25/07/2007
That Time I Got Reincarnated as a Slime the Movie: Scarlet Bond;7.296;Animation;2022;Yasuhito Kikuchi;images\876792.jpg;A long-running conspiracy is swirling over a mysterious power wielded by the Queen in Raja, a small country west of Tempest. When a slime who evolved into a Demon Lord named Rimuru Tempest crosses paths with Hiiro, a survivor of the Ogre race, an incredible adventure packed with new characters begins. The power of bonds will be put to the test!;25/11/2022
The Art of Racing in the Rain;8.194;Drama;2019;Simon Curtis;images\522924.jpg;A family dog – with a near-human soul and a philosopher's mind – evaluates his life through the lessons learned by his human owner, a race-car driver.;8/08/2019
Insurgent;6.363;Action;2015;Robert Schwentke;images\262500.jpg;Beatrice Prior must confront her inner demons and continue her fight against a powerful alliance which threatens to tear her society apart.;18/03/2015
The Imitation Game;8.007;History;2014;Morten Tyldum;images\205596.jpg;Based on the real life story of legendary cryptanalyst Alan Turing, the film portrays the nail-biting race against time by Turing and his brilliant team of code-breakers at Britain's top-secret Government Code and Cypher School at Bletchley Park, during the darkest days of World War II.;14/11/2014
Pretty Young Sister 4;6;Drama;2021;Choi Jin-chul;images\852881.jpg;"Jeong-woo who is tired of instant food and living alone decides to order delivery food. However, Ga-yeong, the delivery driver, is unfriendly even if she was late. To criticize Ga-yeong sarcastically, he asks, ""Will you do everything if I give you money?"" Ga-yeong takes the words seriously and attacks Jeong-woo's house. Woo-hyeon is questioning the woman's underwear found at the house of Hyeon-min who came to play at Jeong-woo's house, and learns the situation through Ga-yeong who just came. He said he was better than Jeong-woo. However, Ga-yeong is already full of thoughts of eating both of them.";15/01/2021
A Walk to Remember;7.743;Drama;2002;Adam Shankman;images\10229.jpg;"When the popular, restless Landon Carter is forced to participate in the school drama production he falls in love with Jamie Sullivan, the daughter of the town's minister. Jamie has a ""to-do"" list for her life and also a very big secret she must keep from Landon.";25/01/2002
Joker;8.166;Crime;2019;Todd Phillips;images\475557.jpg;During the 1980s, a failed stand-up comedian is driven insane and turns to a life of crime and chaos in Gotham City while becoming an infamous psychopathic crime figure.;1/10/2019
Meet the Robinsons;6.906;Animation;2007;Stephen J. Anderson;images\1267.jpg;Lewis, a brilliant young inventor, is keen on creating a time machine to find his mother, who abandoned him in an orphanage. Things take a turn when he meets Wilbur Robinson and his family.;23/03/2007
How to Train Your Dragon: The Hidden World;7.758;Animation;2019;Dean DeBlois;images\166428.jpg;As Hiccup fulfills his dream of creating a peaceful dragon utopia, Toothless’ discovery of an untamed, elusive mate draws the Night Fury away. When danger mounts at home and Hiccup’s reign as village chief is tested, both dragon and rider must make impossible decisions to save their kind.;3/01/2019
Bride of Chucky;6.022;Comedy;1998;Ronny Yu;images\11932.jpg;After being cut apart by the police, killer doll Chucky is resurrected by Tiffany, an ex-girlfriend of the serial murderer whose soul is inside the toy. Following an argument, Chucky kills Tiffany and transfers her soul into a bride doll. To find the magical amulet that can restore them both to human form, Chucky and Tiffany arrange to be driven to New Jersey by Jesse and Jade, who are unaware that their cargo is alive.;16/10/1998
Murder City;7.4;Crime;2023;Michael D. Olmos;images\1142740.jpg;A disgraced former cop finds himself working for a ruthless female kingpin to pay off his estranged father’s debt and protect his family.;29/06/2023
The Amazing Spider-Man;6.693;Action;2012;Marc Webb;images\1930.jpg;Peter Parker is an outcast high schooler abandoned by his parents as a boy, leaving him to be raised by his Uncle Ben and Aunt May. Like most teenagers, Peter is trying to figure out who he is and how he got to be the person he is today. As Peter discovers a mysterious briefcase that belonged to his father, he begins a quest to understand his parents' disappearance – leading him directly to Oscorp and the lab of Dr. Curt Connors, his father's former partner. As Spider-Man is set on a collision course with Connors' alter ego, The Lizard, Peter will make life-altering choices to use his powers and shape his destiny to become a hero.;23/06/2012
Predator;7.5;Science Fiction;1987;John McTiernan;images\106.jpg;A team of elite commandos on a secret mission in a Central American jungle come to find themselves hunted by an extraterrestrial warrior.;12/06/1987
Spider-Man: Far From Home;7.445;Action;2019;Jon Watts;images\429617.jpg;Peter Parker and his friends go on a summer trip to Europe. However, they will hardly be able to rest - Peter will have to agree to help Nick Fury uncover the mystery of creatures that cause natural disasters and destruction throughout the continent.;28/06/2019
The Rescue: The Weight of the World;6.667;Drama;2023;Daniela Goggi;images\1002459.jpg;Julio returns with his family to Argentina after the downfall of the brutal dictatorship that overpowered long-standing democracy. Things soon take an ugly turn as his brother is kidnapped and Julio becomes the lead negotiator with the criminals.;26/10/2023
Baby Driver;7.45;Action;2017;Edgar Wright;images\339403.jpg;After being coerced into working for a crime boss, a young getaway driver finds himself taking part in a heist doomed to fail.;28/06/2017
The Ice Age Adventures of Buck Wild;6.656;Animation;2022;John C. Donkin;images\774825.jpg;The fearless one-eyed weasel Buck teams up with mischievous possum brothers Crash & Eddie as they head off on a new adventure into Buck's home: The Dinosaur World.;28/01/2022
Amazonia: The Catherine Miles Story;6.076;Adventure;1985;Mario Gariazzo;images\28676.jpg;A young woman seeks vengeance and finds love when her parents are killed in the Amazon and she is taken prisoner by an indigenous tribe of headhunters.;9/08/1985
Sonic the Hedgehog;7.34;Action;2020;Jeff Fowler;images\454626.jpg;Powered with incredible speed, Sonic The Hedgehog embraces his new home on Earth. That is, until Sonic sparks the attention of super-uncool evil genius Dr. Robotnik. Now it’s super-villain vs. super-sonic in an all-out race across the globe to stop Robotnik from using Sonic’s unique power for world domination.;12/02/2020
Mission: Impossible - Ghost Protocol;7.073;Action;2011;Brad Bird;images\56292.jpg;Ethan Hunt and his team are racing against time to track down a dangerous terrorist named Hendricks, who has gained access to Russian nuclear launch codes and is planning a strike on the United States. An attempt to stop him ends in an explosion causing severe destruction to the Kremlin and the IMF to be implicated in the bombing, forcing the President to disavow them. No longer being aided by the government, Ethan and his team chase Hendricks around the globe, although they might still be too late to stop a disaster.;7/12/2011
The Dark Knight Rises;7.778;Action;2012;Christopher Nolan;images\49026.jpg;Following the death of District Attorney Harvey Dent, Batman assumes responsibility for Dent's crimes to protect the late attorney's reputation and is subsequently hunted by the Gotham City Police Department. Eight years later, Batman encounters the mysterious Selina Kyle and the villainous Bane, a new terrorist leader who overwhelms Gotham's finest. The Dark Knight resurfaces to protect a city that has branded him an enemy.;17/07/2012
Toy Story 4;7.514;Family;2019;Josh Cooley;images\301528.jpg;"Woody has always been confident about his place in the world and that his priority is taking care of his kid, whether that's Andy or Bonnie. But when Bonnie adds a reluctant new toy called ""Forky"" to her room, a road trip adventure alongside old and new friends will show Woody how big the world can be for a toy.";19/06/2019
I Am Legend;7.201;Drama;2007;Francis Lawrence;images\6479.jpg;Robert Neville is a scientist who was unable to stop the spread of the terrible virus that was incurable and man-made. Immune, Neville is now the last human survivor in what is left of New York City and perhaps the world. For three years, Neville has faithfully sent out daily radio messages, desperate to find any other survivors who might be out there. But he is not alone.;12/12/2007
The Gangster, the Cop, the Devil;7.754;Crime;2019;Lee Won-tae;images\581528.jpg;After barely surviving a violent attack by an elusive serial killer, crime boss Jang Dong-su finds himself forming an unlikely partnership with local detective Jung Tae-seok to catch the sadistic killer simply known as K.;15/05/2019
Batman Begins;7.703;Action;2005;Christopher Nolan;images\272.jpg;Driven by tragedy, billionaire Bruce Wayne dedicates his life to uncovering and defeating the corruption that plagues his home, Gotham City.  Unable to work within the system, he instead creates a new identity, a symbol of fear for the criminal underworld - The Batman.;10/06/2005
The Croods: A New Age;7.516;Animation;2020;Joel Crawford;images\529203.jpg;Searching for a safer habitat, the prehistoric Crood family discovers an idyllic, walled-in paradise that meets all of its needs. Unfortunately, they must also learn to live with the Bettermans -- a family that's a couple of steps above the Croods on the evolutionary ladder. As tensions between the new neighbors start to rise, a new threat soon propels both clans on an epic adventure that forces them to embrace their differences, draw strength from one another, and survive together.;25/11/2020
Women's Prison Massacre;4.27;Action;1983;Bruno Mattei;images\45233.jpg;"Emanuelle, a reporter, comes just a little too close to exposing a corrupt official, and is sent to prison on trumped-up charges. In the prison, the inmates are constantly humiliated and tortured by the prison staff. Overly affectionate prisoners are forced underwater, while others are obliged to look on. Emanuelle finds an enemy in the deranged Albina, who ""runs the prison."" For the pleasure of the warden, Emanuelle and Albina are forced to fight each other with knives. Bad becomes worse when four men awaiting execution escape and take over the prison. Gore flows like water.";31/08/1983
Terrifier;6.5;Horror;2018;Damien Leone;images\420634.jpg;On Halloween night, a young woman finds herself as the obsession of a sadistic murderer known as Art the Clown.;25/01/2018
300: Rise of an Empire;6.1;Action;2014;Noam Murro;images\53182.jpg;Greek general Themistocles attempts to unite all of Greece by leading the charge that will change the course of the war. Themistocles faces the massive invading Persian forces led by mortal-turned-god, Xerxes and Artemesia, the vengeful commander of the Persian navy.;5/03/2014
Wonder Woman;7.235;Action;2017;Patty Jenkins;images\297762.jpg;An Amazon princess comes to the world of Man in the grips of the First World War to confront the forces of evil and bring an end to human conflict.;30/05/2017
Saw III;6.39;Horror;2006;Darren Lynn Bousman;images\214.jpg;Jigsaw has disappeared. Along with his new apprentice Amanda, the puppet-master behind the cruel, intricate games that have terrified a community and baffled police has once again eluded capture and vanished. While city detective scrambles to locate him, Doctor Lynn Denlon and Jeff Reinhart are unaware that they are about to become the latest pawns on his vicious chessboard.;26/10/2006
Guardians of the Galaxy Vol. 2;7.622;Science Fiction;2017;James Gunn;images\283995.jpg;The Guardians must fight to keep their newfound family together as they unravel the mysteries of Peter Quill's true parentage.;19/04/2017
Dragon Ball Z: Broly – The Legendary Super Saiyan;7.221;Animation;1993;Shigeyasu Yamauchi;images\34433.jpg;While the Saiyan Paragus persuades Vegeta to rule a new planet, King Kai alerts Goku of the South Galaxy's destruction by an unknown Super Saiyan.;6/03/1993
Aristotle and Dante Discover the Secrets of the Universe;7.8;Drama;2023;Aitch Alberto;images\500104.jpg;Two teenage Mexican-American loners in 1987 El Paso explore a new, unusual friendship and the difficult road to self-discovery.;8/09/2023
Saw IV;6.164;Horror;2007;Darren Lynn Bousman;images\663.jpg;Jigsaw and his apprentice Amanda are dead. Now, upon the news of Detective Kerry's murder, two seasoned FBI profilers, Agent Strahm and Agent Perez, arrive in the terrified community to assist the veteran Detective Hoffman in sifting through Jigsaw's latest grisly remains and piecing together the puzzle. However, when SWAT Commander Rigg is abducted and thrust into a game, the last officer untouched by Jigsaw has but ninety minutes to overcome a series of demented traps and save an old friend or face the deadly consequences.;25/10/2007
Dragon Ball Z: Wrath of the Dragon;7.241;Animation;1995;Mitsuo Hashimoto;images\39108.jpg;The Z Warriors discover an unopenable music box and are told to open it with the Dragon Balls. The contents turn out to be a warrior named Tapion who had sealed himself inside along with a monster called Hildegarn. Goku must now perfect a new technique to defeat the evil monster.;15/07/1995
The Squad: Home Run;6.4;Action;2023;Benjamin Rocher;images\1020394.jpg;Former Antigang legend Niels Cartier, known for his muscular and unconventional methods, left the force following an intervention that went wrong and led to the death of his wife. When the gang of bank robbers responsible for her death reappears eight years later, Niels won't let anyone stand in his way to seek revenge. Even if it means forming an explosive duo with his temperamental 14-year-old daughter.;25/08/2023
With Every Heartbeat;7.1;Romance;2011;Alexandra-Therese Keining;images\71325.jpg;After they meet at their parent's engagement party, Mia and Frida are intrigued by and attracted to one another, despite Mia's own upcoming engagement to Tim. Mia must decide whether to continue her life with Tim or to follow her heart with Frida.;29/07/2011
My First Barbie: Happy DreamDay;6.433;Family;2023;Kerr Holden;images\1165223.jpg;Sing along with Barbie, Barbie, Teresa, and Renee in this musical adventure as they plan the biggest surprise birthday party ever for Barbie’s sister, Chelsea.;13/02/2023
The Devil Wears Prada;7.388;Comedy;2006;David Frankel;images\350.jpg;Andy moves to New York to work in the fashion industry. Her boss is extremely demanding, cruel and won't let her succeed if she doesn't fit into the high class elegant look of their magazine.;29/06/2006
Evil;7.249;Drama;2003;Mikael Håfström;images\11197.jpg;Stockholm, the fifties. Though academically bright, violent pupil Erik Ponti is expelled from his state school with the headmaster’s words “there’s only one word for people like you – evil… what you need is a good thrashing, and more”. In fact already Erik frequently receives a ‘good’ thrashing at the hands of his sadistic stepfather – so he is packed off by his mother to boardingschool;16/09/2003
Aliens;7.936;Action;1986;James Cameron;images\679.jpg;When Ripley's lifepod is found by a salvage crew over 50 years later, she finds that terra-formers are on the very planet they found the alien species. When the company sends a family of colonists out to investigate her story—all contact is lost with the planet and colonists. They enlist Ripley and the colonial marines to return and search for answers.;18/07/1986
Ford v Ferrari;8.012;Drama;2019;James Mangold;images\359724.jpg;American car designer Carroll Shelby and the British-born driver Ken Miles work together to battle corporate interference, the laws of physics, and their own personal demons to build a revolutionary race car for Ford Motor Company and take on the dominating race cars of Enzo Ferrari at the 24 Hours of Le Mans in France in 1966.;13/11/2019
Morbius;6.093;Action;2022;Daniel Espinosa;images\526896.jpg;Dangerously ill with a rare blood disorder, and determined to save others suffering his same fate, Dr. Michael Morbius attempts a desperate gamble. What at first appears to be a radical success soon reveals itself to be a remedy potentially worse than the disease.;30/03/2022
The Town;7.202;Crime;2010;Ben Affleck;images\23168.jpg;Doug MacRay is a longtime thief, who, smarter than the rest of his crew, is looking for his chance to exit the game. When a bank job leads to the group kidnapping an attractive branch manager, he takes on the role of monitoring her – but their burgeoning relationship threatens to unveil the identities of Doug and his crew to the FBI Agent who is on their case.;15/09/2010
A Really Haunted Loud House;5.75;TV Movie;2023;Jonathan Judge;images\1146147.jpg;Lincoln and his best friend, Clyde, struggle to decide whether to participate in the Loud family Spooktacular, attend their friend, Xander's, party, or go trick-or-treating on Halloween.;28/09/2023
It Chapter Two;6.85;Horror;2019;Andy Muschietti;images\474350.jpg;27 years after overcoming the malevolent supernatural entity Pennywise, the former members of the Losers' Club, who have grown up and moved away from Derry, are brought back together by a devastating phone call.;4/09/2019
Hercules;7.501;Animation;1997;Ron Clements;images\11970.jpg;Bestowed with superhuman strength, a young mortal named Hercules sets out to prove himself a hero in the eyes of his father, the great god Zeus. Along with his friends Pegasus, a flying horse, and Phil, a personal trainer, Hercules is tricked by the hilarious, hotheaded villain Hades, who's plotting to take over Mount Olympus!;20/06/1997
God Is a Bullet;6.315;Thriller;2023;Nick Cassavetes;images\808396.jpg;Based on true events and the novel of the same name. Vice detective Bob Hightower finds his ex-wife murdered and daughter kidnapped by a cult. Frustrated by the botched official investigations, he quits the force and infiltrates the cult to hunt down the leader with the help of the cult’s only female victim escapee, Case Hardin.;22/06/2023
Monsters University;7.031;Animation;2013;Dan Scanlon;images\62211.jpg;A look at the relationship between Mike and Sulley during their days at Monsters University — when they weren't necessarily the best of friends.;19/06/2013
Old Dads;6.34;Comedy;2023;Bill Burr;images\987917.jpg;A cranky middle-aged dad and his two best friends find themselves out of step in a changing world of millennial CEOs and powerful preschool principals.;20/10/2023
The Good, the Bad and the Ugly;8.469;Western;1966;Sergio Leone;images\429.jpg;While the Civil War rages on between the Union and the Confederacy, three men – a quiet loner, a ruthless hitman, and a Mexican bandit – comb the American Southwest in search of a strongbox containing $200,000 in stolen gold.;23/12/1966
Indiana Jones and the Last Crusade;7.85;Adventure;1989;Steven Spielberg;images\89.jpg;In 1938, an art collector appeals to eminent archaeologist Dr. Indiana Jones to embark on a search for the Holy Grail. Indy learns that a medieval historian has vanished while searching for it, and the missing man is his own father, Dr. Henry Jones Sr.. He sets out to rescue his father by following clues in the old man's notebook, which his father had mailed to him before he went missing. Indy arrives in Venice, where he enlists the help of a beautiful academic, Dr. Elsa Schneider, along with Marcus Brody and Sallah. Together they must stop the Nazis from recovering the power of eternal life and taking over the world!;24/05/1989
Maze Runner: The Scorch Trials;6.724;Science Fiction;2015;Wes Ball;images\294254.jpg;Thomas and his fellow Gladers face their greatest challenge yet: searching for clues about the mysterious and powerful organization known as WCKD. Their journey takes them to the Scorch, a desolate landscape filled with unimaginable obstacles. Teaming up with resistance fighters, the Gladers take on WCKD’s vastly superior forces and uncover its shocking plans for them all.;9/09/2015
Scarygirl;7.194;Animation;2023;Ricard Cussó;images\502345.jpg;As her world is shrouded in darkness, a young girl must overcome her fears and travel to a mysterious city of light, save her father from a dangerous scientist and prevent the destruction of her planet.;5/10/2023
Memories;7.429;Fantasy;1995;Koji Morimoto;images\42994.jpg;"In this anime anthology, a salvage ship crew happens upon a haunted vessel in ""Magnetic Rose""; a cold tablet turns a lab worker into a biological weapon in ""Stink Bomb""; and an urban populace carries on an endless war with an unseen foe in ""Cannon Fodder.""";23/12/1995
Meet Joe Black;7.306;Fantasy;1998;Martin Brest;images\297.jpg;"When the grim reaper comes to collect the soul of megamogul Bill Parrish, he arrives with a proposition: Host him for a ""vacation"" among the living in trade for a few more days of existence. Parrish agrees, and using the pseudonym Joe Black, Death begins taking part in Parrish's daily agenda and falls in love with the man's daughter. Yet when Black's holiday is over, so is Parrish's life.";12/11/1998
Emanuelle and the White Slave Trade;4.671;Drama;1978;Joe D'Amato;images\40132.jpg;While attempting to interview an elusive gangster, photojournalist Emanuelle notices a man pushing a girl in a wheelchair through the airport. Later, in another country she sees the same man and the girl up and walking. Intrigued, she does a bit of investigating and uncovers an organization dealing in the buying and selling of young women. She goes undercover into the organization but finds that getting out again could cost her her career...and her life.;20/04/1978
Lamborghini: The Man Behind the Legend;6.402;Drama;2022;Bobby Moresco;images\457232.jpg;Follow the launch of Lamborghini’s career as a manufacturer of tractors, a creator of military vehicles during World War II, and the designer of Lamborghini cars, which he launched in 1963 as the high-end sports car company Automobili Lamborghini.;18/11/2022
Inglourious Basterds;8.216;Drama;2009;Quentin Tarantino;images\16869.jpg;"In Nazi-occupied France during World War II, a group of Jewish-American soldiers known as ""The Basterds"" are chosen specifically to spread fear throughout the Third Reich by scalping and brutally killing Nazis. The Basterds, lead by Lt. Aldo Raine soon cross paths with a French-Jewish teenage girl who runs a movie theater in Paris which is targeted by the soldiers.";19/08/2009
Moonfall;6.35;Science Fiction;2022;Roland Emmerich;images\406759.jpg;A mysterious force knocks the moon from its orbit around Earth and sends it hurtling on a collision course with life as we know it.;3/02/2022
Indiana Jones and the Kingdom of the Crystal Skull;6.001;Adventure;2008;Steven Spielberg;images\217.jpg;Set during the Cold War, the Soviets—led by sword-wielding Irina Spalko—are in search of a crystal skull which has supernatural powers related to a mystical Lost City of Gold. Indy is coerced to head to Peru at the behest of a young man whose friend—and Indy's colleague—Professor Oxley has been captured for his knowledge of the skull's whereabouts.;21/05/2008
Free Guy;7.537;Comedy;2021;Shawn Levy;images\550988.jpg;A bank teller discovers he is actually a background player in an open-world video game, and decides to become the hero of his own story. Now, in a world where there are no limits, he is determined to be the guy who saves his world his way before it's too late.;11/08/2021
The Hangover Part II;6.469;Comedy;2011;Todd Phillips;images\45243.jpg;The Hangover crew heads to Thailand for Stu's wedding. After the disaster of a bachelor party in Las Vegas last year, Stu is playing it safe with a mellow pre-wedding brunch. However, nothing goes as planned and Bangkok is the perfect setting for another adventure with the rowdy group.;25/05/2011
Joy;6.512;Drama;2015;David O. Russell;images\274479.jpg;A story based on the life of a struggling Long Island single mom who became one of the country's most successful entrepreneurs.;24/12/2015
Baywatch;6.092;Comedy;2017;Seth Gordon;images\339846.jpg;Devoted lifeguard Mitch Buchannon butts heads with a brash new recruit. Together, they uncover a local criminal plot that threatens the future of the Bay.;25/05/2017
Mortal Kombat Legends: Battle of the Realms;7.696;Animation;2021;Ethan Spaulding;images\841755.jpg;The Earthrealm heroes must journey to the Outworld and fight for the survival of their homeland, invaded by the forces of evil warlord Shao Kahn, in the tournament to end all tournaments: the final Mortal Kombat.;31/08/2021
Scary Movie 2;5.79;Comedy;2001;Keenen Ivory Wayans;images\4248.jpg;"While the original parodied slasher flicks like Scream, Keenen Ivory Wayans's sequel to Scary Movie takes comedic aim at haunted house movies. A group of students visit a mansion called ""Hell House,"" and murderous high jinks ensue.";4/07/2001
TAYLOR SWIFT | THE ERAS TOUR;8.3;Music;2023;Sam Wrench;images\1160164.jpg;The cultural phenomenon continues on the big screen! Immerse yourself in this once-in-a-lifetime concert film experience with a breathtaking, cinematic view of the history-making tour.;13/10/2023
