Mulan II;6.478;Animation;2004;Darrell Rooney;images\12242.jpg;Fa Mulan gets the surprise of her young life when her love, Captain Li Shang asks for her hand in marriage. Before the two can have their happily ever after, the Emperor assigns them a secret mission, to escort three princesses to Chang'an, China. Mushu is determined to drive a wedge between the couple after he learns that he will lose his guardian job if Mulan marries into the Li family.;3/11/2004
Abraham Lincoln: Vampire Hunter;5.717;Action;2012;Timur Bekmambetov;images\72331.jpg;President Lincoln's mother is killed by a supernatural creature, which fuels his passion to crush vampires and their slave-owning helpers.;20/06/2012
The Kissing Booth 3;6.959;Romance;2021;Vince Marcello;images\727745.jpg;It’s the summer before Elle heads to college, and she has a secret decision to make. Elle has been accepted into Harvard, where boyfriend Noah is matriculating, and also Berkeley, where her BFF Lee is headed and has to decide if she should stay or not.;11/08/2021
Dawn of the Dead;7.5;Horror;1978;George A. Romero;images\923.jpg;During an ever-growing epidemic of zombies that have risen from the dead, two Philadelphia SWAT team members, a traffic reporter, and his television-executive girlfriend seek refuge in a secluded shopping mall.;2/09/1978
Blade II;6.52;Fantasy;2002;Guillermo del Toro;images\36586.jpg;A rare mutation has occurred within the vampire community - The Reaper. A vampire so consumed with an insatiable bloodlust that they prey on vampires as well as humans, transforming victims who are unlucky enough to survive into Reapers themselves. Blade is asked by the Vampire Nation for his help in preventing a nightmare plague that would wipe out both humans and vampires.;22/03/2002
Training Day;7.489;Action;2001;Antoine Fuqua;images\2034.jpg;On his first day on the job as a narcotics officer, a rookie cop works with a rogue detective who isn't what he appears.;5/10/2001
Cheeky;5.551;Comedy;2000;Tinto Brass;images\22705.jpg;While scouting out apartments in London for her Venetian boyfriend, Carla rents an apartment that overlooks the Thames. There she meet the lesbian hyper-horny real estate agent Moira.;28/01/2000
Carrie;7.29;Horror;1976;Brian De Palma;images\7340.jpg;In this chilling adaptation of Stephen King's horror novel, withdrawn and sensitive teen Carrie White faces taunting from classmates at school and abuse from her fanatically pious mother at home. When strange occurrences start happening around Carrie, she begins to suspect that she has supernatural powers. Invited to the prom by the empathetic Tommy Ross, Carrie tries to let her guard down, but things eventually take a dark and violent turn.;3/11/1976
Men in Black II;6.36;Action;2002;Barry Sonnenfeld;images\608.jpg;Kay and Jay reunite to provide our best, last and only line of defense against a sinister seductress who levels the toughest challenge yet to the MIB's untarnished mission statement – protecting Earth from the scum of the universe. It's been four years since the alien-seeking agents averted an intergalactic disaster of epic proportions. Now it's a race against the clock as Jay must convince Kay – who not only has absolutely no memory of his time spent with the MIB, but is also the only living person left with the expertise to save the galaxy – to reunite with the MIB before the earth submits to ultimate destruction.;3/07/2002
The Goonies;7.519;Adventure;1985;Richard Donner;images\9340.jpg;A young teenager named Mikey Walsh finds an old treasure map in his father's attic. Hoping to save their homes from demolition, Mikey and his friends Data Wang, Chunk Cohen, and Mouth Devereaux run off on a big quest to find the secret stash of Pirate One-Eyed Willie.;7/06/1985
The Crow;7.506;Fantasy;1994;Alex Proyas;images\9495.jpg;Exactly one year after young rock guitarist Eric Draven and his fiancée are brutally killed by a ruthless gang of criminals, Draven—watched over by a hypnotic crow—returns from the grave to exact revenge.;11/05/1994
Scrooge: A Christmas Carol;6.7;Animation;2022;Stephen Donnelly;images\1001865.jpg;On a cold Christmas Eve, selfish miser Ebenezer Scrooge has one night left to face his past — and change the future — before time runs out.;18/11/2022
Fullmetal Alchemist: The Final Alchemy;6.337;Action;2022;Fumihiko Sori;images\960704.jpg;The Elric brothers’ long and winding journey comes to a close in this epic finale, where they must face off against an unworldly, nationwide threat.;24/06/2022
Idiocracy;6.32;Comedy;2006;Mike Judge;images\7512.jpg;To test its top-secret Human Hibernation Project, the Pentagon picks the most average Americans it can find - an Army private and a prostitute - and sends them to the year 2505 after a series of freak events. But when they arrive, they find a civilization so dumbed-down that they're the smartest people around.;1/09/2006
Jai Lava Kusa;6.7;Action;2017;Bobby Kolli;images\101736.jpg;Jai, Lava and Kusa are triplets who get separated during their childhood because of small clashes. While Jai becomes an evil blooded criminal, the other two, Kusa and Lava end up as small-time crook and bank manager respectively. The twist in the tale arises when Jai kidnaps both the brothers and asks them to help him in his political growth. What is Jai’s agenda? Why did he kidnap his brothers? How can the innocent Lava and Kusa manage the criminal Jai?;21/09/2017
Never Back Down: No Surrender;7.059;Drama;2016;Michael Jai White;images\391757.jpg;Picking up after the events of Never Back Down 2, former MMA champion Case Walker is on the comeback trail to become champion once again.;5/06/2016
Grease;7.395;Romance;1978;Randal Kleiser;images\621.jpg;Australian good girl Sandy and greaser Danny fell in love over the summer. But when they unexpectedly discover they're now in the same high school, will they be able to rekindle their romance despite their eccentric friends?;7/07/1978
Cast Away;7.662;Adventure;2000;Robert Zemeckis;images\8358.jpg;Chuck Nolan, a top international manager for FedEx, and Kelly, a Ph.D. student, are in love and heading towards marriage. Then Chuck's plane to Malaysia crashes at sea during a terrible storm. He's the only survivor, and finds himself marooned on a desolate island. With no way to escape, Chuck must find ways to survive in his new home.;22/12/2000
Lady Bird;7.272;Drama;2017;Greta Gerwig;images\391713.jpg;Lady Bird McPherson, a strong willed, deeply opinionated, artistic 17 year old comes of age in Sacramento. Her relationship with her mother and her upbringing are questioned and tested as she plans to head off to college.;1/09/2017
A Dog's Purpose;7.621;Adventure;2017;Lasse Hallström;images\381289.jpg;A dog goes on quest to discover his purpose in life over the course of several lifetimes with multiple owners.;19/01/2017
Life in a Year;8.294;Drama;2020;Mitja Okorn;images\447362.jpg;A 17 year old finds out that his girlfriend is dying, so he sets out to give her an entire life, in the last year she has left.;27/11/2020
Scent of a Woman;7.77;Drama;1992;Martin Brest;images\9475.jpg;Charlie Simms is a student at a private preparatory school who comes from a poor family. To earn the money for his flight home to Gresham, Oregon for Christmas, Charlie takes a job over Thanksgiving looking after retired U.S. Army officer Lieutenant Colonel Frank Slade, a cantankerous middle-aged man who lives with his niece and her family.;23/12/1992
Vacation Friends;7.139;Comedy;2021;Clay Tarver;images\653349.jpg;When a straight-laced couple that has fun with a rowdy couple on vacation in Mexico return to the States, they discover that the crazy couple they met in Mexico followed them back home and decide to play tricks on them.;27/08/2021
Pocahontas;6.928;Adventure;1995;Mike Gabriel;images\10530.jpg;Pocahontas, daughter of a Native American tribe chief, falls in love with an English soldier as colonists invade 17th century Virginia.;14/06/1995
Til Death Do Us Part;5.989;Horror;2023;Timothy Woodward Jr.;images\1126577.jpg;After bailing on her wedding, a former bride-to-be must fight off her ex-groom and seven angry killer groomsmen in order to survive the night.;3/08/2023
The Prince of Egypt;7.253;Adventure;1998;Simon Wells;images\9837.jpg;This is the extraordinary tale of two brothers named Moses and Ramses, one born of royal blood, and one an orphan with a secret past. Growing up the best of friends, they share a strong bond of free-spirited youth and good-natured rivalry. But the truth will ultimately set them at odds, as one becomes the ruler of the most powerful empire on earth, and the other the chosen leader of his people! Their final confrontation will forever change their lives and the world.;16/12/1998
Dark Phoenix;5.991;Fantasy;2019;Simon Kinberg;images\320288.jpg;The X-Men face their most formidable and powerful foe when one of their own, Jean Grey, starts to spiral out of control. During a rescue mission in outer space, Jean is nearly killed when she's hit by a mysterious cosmic force. Once she returns home, this force not only makes her infinitely more powerful, but far more unstable. The X-Men must now band together to save her soul and battle aliens that want to use Grey's new abilities to rule the galaxy.;5/06/2019
Samaritan;6.8;Science Fiction;2022;Julius Avery;images\629176.jpg;Thirteen year old Sam Cleary suspects that his mysteriously reclusive neighbor Mr. Smith is actually the legendary vigilante Samaritan, who was reported dead 25 years ago. With crime on the rise and the city on the brink of chaos, Sam makes it his mission to coax his neighbor out of hiding to save the city from ruin.;25/08/2022
Barbie as The Princess & the Pauper;7.481;Animation;2004;William Lau;images\15165.jpg;In her first animated musical featuring seven original songs, Barbie comes to life in this modern re-telling of a classic tale of mistaken identity and the power of friendship. Based on the story by Mark Twain.;28/09/2004
Exploits of a Young Don Juan;5.6;Comedy;1986;Gianfranco Mingozzi;images\81774.jpg;It's 1914. Sixteen-year-old Roger returns home to spend his summer vacation. His initial efforts are unsuccessful, but World War I breaks out and men are seen marching off to battle. Roger goes overboard when he is presented with several amorous opportunities.;4/11/1986
Dawn of the Dead;7.047;Horror;2004;Zack Snyder;images\924.jpg;A group of survivors take refuge in a shopping mall after the world is taken over by aggressive, flesh-eating zombies.;19/03/2004
Teen Wolf: The Movie;7.633;Action;2023;Russell Mulcahy;images\877703.jpg;The wolves are howling once again, as a terrifying ancient evil emerges in Beacon Hills. Scott McCall, no longer a teenager yet still an Alpha, must gather new allies and reunite trusted friends to fight back against this powerful and deadly enemy.;18/01/2023
Athena;6.613;Action;2022;Romain Gavras;images\852046.jpg;Hours after the tragic death of their youngest brother in unexplained circumstances, three siblings have their lives thrown into chaos.;9/09/2022
Bram Stoker's Dracula;7.448;Romance;1992;Francis Ford Coppola;images\6114.jpg;When Dracula leaves the captive Jonathan Harker and Transylvania for London in search of Mina Murray, the reincarnation of Dracula's long-dead wife Elisabeta, obsessed vampire hunter Dr. Van Helsing sets out to end the madness.;13/11/1992
Captain America: The Winter Soldier;7.669;Action;2014;Anthony Russo;images\100402.jpg;After the cataclysmic events in New York with The Avengers, Steve Rogers, aka Captain America is living quietly in Washington, D.C. and trying to adjust to the modern world. But when a S.H.I.E.L.D. colleague comes under attack, Steve becomes embroiled in a web of intrigue that threatens to put the world at risk. Joining forces with the Black Widow, Captain America struggles to expose the ever-widening conspiracy while fighting off professional assassins sent to silence him at every turn. When the full scope of the villainous plot is revealed, Captain America and the Black Widow enlist the help of a new ally, the Falcon. However, they soon find themselves up against an unexpected and formidable enemy—the Winter Soldier.;20/03/2014
Sneakers;6.895;Comedy;1992;Phil Alden Robinson;images\2322.jpg;When shadowy U.S. intelligence agents blackmail a reformed computer hacker and his eccentric team of security experts into stealing a code-breaking 'black box' from a Soviet-funded genius, they uncover a bigger conspiracy. Now, he and his 'sneakers' must save themselves and the world economy by retrieving the box from their blackmailers.;9/09/1992
The Wonderful World of Mickey Mouse: Steamboat Silly;7.267;Animation;2023;Eddie Trigueros;images\1139979.jpg;Mickey Mouse and his friends must stop hundreds of old film reel versions of Mickey from wreaking havoc all over town.;28/07/2023
Blonde;6.1;Drama;2022;Andrew Dominik;images\301502.jpg;From her volatile childhood as Norma Jeane, through her rise to stardom and romantic entanglements, this reimagined fictional portrait of Hollywood legend Marilyn Monroe blurs the lines of fact and fiction to explore the widening split between her public and private selves.;16/09/2022
Nacho Libre;6.378;Comedy;2006;Jared Hess;images\9353.jpg;"Nacho Libre is loosely based on the story of Fray Tormenta (""Friar Storm""), aka Rev. Sergio Gutierrez Benitez, a real-life Mexican Catholic priest who had a 23-year career as a masked luchador. He competed in order to support the orphanage he directed.";16/06/2006
Paul;6.708;Adventure;2011;Greg Mottola;images\39513.jpg;For the past 60 years, a space-traveling smart-ass named Paul has been locked up in a top-secret military base, advising world leaders about his kind. But when he worries he’s outlived his usefulness and the dissection table is drawing uncomfortably close, Paul escapes on the first RV that passes by his compound in Area 51. Fortunately, it contains the two earthlings who are most likely to rescue and harbor an alien on the run.;14/02/2011
Magnum Force;7.135;Drama;1973;Ted Post;images\10648.jpg;"""Dirty"" Harry Callahan is a San Francisco Police Inspector on the trail of a group of rogue cops who have taken justice into their own hands. When shady characters are murdered one after another in grisly fashion, only Dirty Harry can stop them.";13/12/1973
A Haunted House 2;6.096;Comedy;2014;Michael Tiddes;images\184345.jpg;After exorcising the demons of his ex-, Malcolm starts afresh with his new girlfriend and her two children. After moving into their dream home, Malcolm is once again plagued by bizarre paranormal events.;17/04/2014
Get Out;7.618;Mystery;2017;Jordan Peele;images\419430.jpg;Chris and his girlfriend Rose go upstate to visit her parents for the weekend. At first, Chris reads the family's overly accommodating behavior as nervous attempts to deal with their daughter's interracial relationship, but as the weekend progresses, a series of increasingly disturbing discoveries lead him to a truth that he never could have imagined.;24/02/2017
American Made;6.9;Action;2017;Doug Liman;images\337170.jpg;The true story of pilot Barry Seal, who transported contraband for the CIA and the Medellin cartel in the 1980s.;18/08/2017
Love in Taipei;6.981;Romance;2023;Arvin Chen;images\745391.jpg;A young American woman is sent by her parents to a cultural immersion program in Taipei where she begins a new journey of self-discovery and romance.;10/08/2023
Sons of Summer;7;Action;2023;Clive Fleury;images\1152238.jpg;To mark the anniversary of his father's death, Sean takes his friends on a road trip to his surfer dad's favorite beach. But Sean's drug-dealing friend forces him to do one last favor – steal a heroin shipment from a local mobster.;28/07/2023
Jack the Giant Slayer;5.822;Fantasy;2013;Bryan Singer;images\81005.jpg;The story of an ancient war that is reignited when a young farmhand unwittingly opens a gateway between our world and a fearsome race of giants. Unleashed on the Earth for the first time in centuries, the giants strive to reclaim the land they once lost, forcing the young man, Jack into the battle of his life to stop them. Fighting for a kingdom, its people, and the love of a brave princess, he comes face to face with the unstoppable warriors he thought only existed in legend–and gets the chance to become a legend himself.;27/02/2013
The Wonderful Story of Henry Sugar;7.316;Comedy;2023;Wes Anderson;images\923939.jpg;A rich man learns about a guru who can see without using his eyes. He sets out to master the skill in order to cheat at gambling.;20/09/2023
You People;5.756;Romance;2023;Kenya Barris;images\866413.jpg;A new couple and their families reckon with modern love amid culture clashes, societal expectations and generational differences.;20/01/2023
Fantastic Four: Rise of the Silver Surfer;5.594;Adventure;2007;Tim Story;images\1979.jpg;The Fantastic Four return to the big screen as a new and all powerful enemy threatens the Earth. The seemingly unstoppable 'Silver Surfer', but all is not what it seems and there are old and new enemies that pose a greater threat than the intrepid superheroes realize.;13/06/2007
1917;7.991;War;2019;Sam Mendes;images\530915.jpg;At the height of the First World War, two young British soldiers must cross enemy territory and deliver a message that will stop a deadly attack on hundreds of soldiers.;25/12/2019
Deuce Bigalow: Male Gigolo;5.954;Comedy;1999;Mike Mitchell;images\10402.jpg;Deuce Bigalow is a less than attractive, down on his luck aquarium cleaner. One day he wrecks the house of a gigolo and needs quick money to repair it. The only way he can make it is to become a gigolo himself, taking on an unusual mix of female clients. He encounters a couple of problems, though. He falls in love with one of his unusual clients, and a sleazy police officer is hot on his trail.;10/12/1999
Descendants 3;7.7;Family;2019;Kenny Ortega;images\506574.jpg;The teenagers of Disney's most infamous villains return to the Isle of the Lost to recruit a new batch of villainous offspring to join them at Auradon Prep.;2/08/2019
Rambo: Last Blood;6.524;Action;2019;Adrian Grünberg;images\522938.jpg;After fighting his demons for decades, John Rambo now lives in peace on his family ranch in Arizona, but his rest is interrupted when Gabriela, the granddaughter of his housekeeper María, disappears after crossing the border into Mexico to meet her biological father. Rambo, who has become a true father figure for Gabriela over the years, undertakes a desperate and dangerous journey to find her.;19/09/2019
Demolition Man;6.691;Crime;1993;Marco Brambilla;images\9739.jpg;Simon Phoenix, a violent criminal cryogenically frozen in 1996, escapes during a parole hearing in 2032 in the utopia of San Angeles. Police are incapable of dealing with his violent ways and turn to his captor, who had also been cryogenically frozen after being wrongfully accused of killing 30 innocent people while apprehending Phoenix.;8/10/1993
The Big Lebowski;7.841;Comedy;1998;Joel Coen;images\115.jpg;Jeffrey 'The Dude' Lebowski, a Los Angeles slacker who only wants to bowl and drink White Russians, is mistaken for another Jeffrey Lebowski, a wheelchair-bound millionaire, and finds himself dragged into a strange series of events involving nihilists, adult film producers, ferrets, errant toes, and large sums of money.;6/03/1998
District 9;7.425;Science Fiction;2009;Neill Blomkamp;images\17654.jpg;Thirty years ago, aliens arrive on Earth. Not to conquer or give aid, but to find refuge from their dying planet. Separated from humans in a South African area called District 9, the aliens are managed by Multi-National United, which is unconcerned with the aliens' welfare but will do anything to master their advanced technology. When a company field agent contracts a mysterious virus that begins to alter his DNA, there is only one place he can hide: District 9.;5/08/2009
Home Alone 4;4.457;Comedy;2002;Rod Daniel;images\12536.jpg;Kevin McCallister's parents have split up. Now living with his mom, he decides to spend Christmas with his dad at the mansion of his father's rich girlfriend, Natalie. Meanwhile robber Marv Merchants, one of the villains from the first two movies, partners up with a new criminal named Vera to hit Natalie's mansion.;3/11/2002
Tom Clancy's Without Remorse;7.023;Adventure;2021;Stefano Sollima;images\567189.jpg;An elite Navy SEAL uncovers an international conspiracy while seeking justice for the murder of his pregnant wife.;29/04/2021
A Flintstone Christmas;6.488;Animation;1977;Charles A. Nichols;images\26542.jpg;Santa has an accident at Fred's house on Christmas Eve, Fred and Barney have to continue his run for him.;7/12/1977
The Hunchback of Notre Dame;7.106;Drama;1996;Gary Trousdale;images\10545.jpg;At the urging of his gargoyle pals, Quasimodo leaves Notre Dame tower against the wishes of his guardian, the evil Judge Claude Frollo. He ventures out to the Festival of Fools and finds his first true friend, a Romani woman named Esmeralda, who entrusts him with a secret. When the secret is revealed, Quasi soon finds himself fighting to save the people and city he loves.;21/06/1996
Disney 100: Remember That;10;Music;2023;Unknown;images\1122214.jpg;Celebrate 100 years of Disney, with Disney's greatest characters being discussed by the biggest stars and fans, as they reflect on storytelling moments that shaped our culture.;23/10/2023
Beau Is Afraid;6.803;Comedy;2023;Ari Aster;images\798286.jpg;A paranoid man embarks on an epic odyssey to get home to his mother.;14/04/2023
Armageddon;6.831;Action;1998;Michael Bay;images\95.jpg;When an asteroid threatens to collide with Earth, NASA honcho Dan Truman determines the only way to stop it is to drill into its surface and detonate a nuclear bomb. This leads him to renowned driller Harry Stamper, who agrees to helm the dangerous space mission provided he can bring along his own hotshot crew. Among them is the cocksure A.J. who Harry thinks isn't good enough for his daughter, until the mission proves otherwise.;1/07/1998
The Fabelmans;7.711;Drama;2022;Steven Spielberg;images\804095.jpg;Growing up in post-World War II era Arizona, young Sammy Fabelman aspires to become a filmmaker as he reaches adolescence, but soon discovers a shattering family secret and explores how the power of films can help him see the truth.;11/11/2022
Bound by Honor;8.112;Crime;1993;Taylor Hackford;images\9702.jpg;"Based on the true life experiences of poet Jimmy Santiago Baca, the film focuses on half-brothers Paco and Cruz, and their bi-racial cousin Miklo. It opens in 1972, as the three are members of an East L.A. gang known as the ""Vatos Locos"", and the story focuses on how a violent crime and the influence of narcotics alter their lives. Miklo is incarcerated and sent to San Quentin, where he makes a ""home"" for himself. Cruz becomes an exceptional artist, but a heroin addiction overcomes him with tragic results. Paco becomes a cop and an enemy to his ""carnal"", Miklo.";5/02/1993
The Big 4;6.952;Action;2022;Timo Tjahjanto;images\683328.jpg;A by-the-book female detective teams up with four down-on-their-luck assassins to investigate her father's murder.;19/12/2022
MexZombies;7.1;Horror;2022;Chava Cartas;images\675054.jpg;A group of teenagers must face a zombie apocalypse, and help reestablish order.;26/10/2022
Hawaiian Vacation;7.012;Animation;2011;Gary Rydstrom;images\77887.jpg;The toys throw Ken and Barbie a Hawaiian vacation in Bonnie's room.;16/06/2011
Predator 2;6.263;Science Fiction;1990;Stephen Hopkins;images\169.jpg;A police chief in the war-torn streets of Los Angeles discovers that an extraterrestrial creature is hunting down residents - and that he is the next target.;21/11/1990
Bruce Almighty;6.71;Fantasy;2003;Tom Shadyac;images\310.jpg;Bruce Nolan toils as a 'human interest' television reporter in Buffalo, N.Y., but despite his high ratings and the love of his beautiful girlfriend, Bruce remains unfulfilled. At the end of the worst day in his life, he angrily ridicules God—and the Almighty responds, endowing Bruce with all of His divine powers.;23/05/2003
Alexander;5.921;War;2004;Oliver Stone;images\1966.jpg;Alexander, the King of Macedonia, leads his legions against the giant Persian Empire. After defeating the Persians, he leads his army across the then known world, venturing farther than any westerner had ever gone, all the way to India.;21/11/2004
Stand by Me Doraemon 2;7.653;Animation;2020;Takashi Yamazaki;images\728754.jpg;Nobita travels to the future to show his beloved grandma his bride, but adult Nobita has fled his own wedding.;20/11/2020
Rurouni Kenshin: The Beginning;7.642;Action;2021;Keishi Otomo;images\672322.jpg;Before he was a protector, Kenshin was a fearsome assassin known as Battosai. But when he meets gentle Tomoe Yukishiro, a beautiful young woman who carries a huge burden in her heart, his life will change forever.;4/06/2021
The Santa Clause;6.445;Fantasy;1994;John Pasquin;images\11395.jpg;On Christmas Eve, divorced dad Scott Calvin and his son discover Santa Claus has fallen off their roof. When Scott takes the reins of the magical sleigh, he finds he is now the new Santa, and must convince a world of disbelievers, including himself.;11/11/1994
Berserk: The Golden Age Arc II - The Battle for Doldrey;7.309;Action;2012;Toshiyuki Kubooka;images\118412.jpg;The Band of the Hawk participates in the Midland war campaign. On the bloody battlefield, they conquer decisive victories that lead them to Doldrey, an old fortress that will decide the outcome of the war.;23/06/2012
