Hyungsu: Forbidden Love;6;Drama;2020;Kim Jin-woo-II;images\727209.jpg;Seok-hyun, the younger brother of Kyu-hyun, comes between Eun-jung and Kyu-hyun. Seok-hyun, an archer, demands money from his brother and sister-in-law. When they are not accepted, they are overwhelmed with anger. On the other hand, Eunjung secretly sees another man pulled into the house and enjoyed the meeting, and I got caught by Seokhyun. Hyung-su is caught in a big weakness Eventually, she lends money to Seok-hyun. After that day, Seok-hyun continued looking for his sister-in-law and demanding money, When the sister-in-law says that he has no money, he wants her body...;11/03/2020
Aliens vs Predator: Requiem;5.163;Fantasy;2007;Colin Strause;images\440.jpg;The iconic creatures from two of the scariest film franchises in movie history wage their most brutal battle ever—in our own backyard. The small town of Gunnison, Colorado becomes a war zone between two of the deadliest extra-terrestrial life forms—the Alien and the Predator. When a Predator scout ship crash-lands in the hills outside the town, Alien Facehuggers and a hybrid Alien/Predator are released and begin to terrorize the town.;25/12/2007
Jack Reacher: Never Go Back;5.956;Action;2016;Edward Zwick;images\343611.jpg;When Major Susan Turner is arrested for treason, ex-investigator Jack Reacher undertakes the challenging task to prove her innocence and ends up exposing a shocking conspiracy.;19/10/2016
Alvin and the Chipmunks;5.805;Comedy;2007;Tim Hill;images\6477.jpg;A struggling songwriter named Dave Seville finds success when he comes across a trio of singing chipmunks: mischievous leader Alvin, brainy Simon, and chubby, impressionable Theodore.;13/12/2007
Kick-Ass;7.1;Action;2010;Matthew Vaughn;images\23483.jpg;Dave Lizewski is an unnoticed high school student and comic book fan who one day decides to become a super-hero, even though he has no powers, training or meaningful reason to do so.;22/03/2010
The Jungle Book;6.86;Family;2016;Jon Favreau;images\278927.jpg;A man-cub named Mowgli fostered by wolves. After a threat from the tiger Shere Khan, Mowgli is forced to flee the jungle, by which he embarks on a journey of self discovery with the help of the panther, Bagheera and the free-spirited bear, Baloo.;7/04/2016
101 Dalmatians;5.9;Family;1996;Stephen Herek;images\11674.jpg;An evil, high-fashion designer plots to steal Dalmatian puppies in order to make an extravagant fur coat, but instead creates an extravagant mess.;27/11/1996
Django Unchained;8.173;Drama;2012;Quentin Tarantino;images\68718.jpg;With the help of a German bounty hunter, a freed slave sets out to rescue his wife from a brutal Mississippi plantation owner.;25/12/2012
Medieval;7.106;Action;2022;Petr Jákl;images\551271.jpg;The story of 14th century Czech icon and warlord Jan Zizka who defeated armies of the Teutonic Order and the Holy Roman Empire.;8/09/2022
Not Another Teen Movie;5.784;Comedy;2001;Joel Gallen;images\11397.jpg;On a bet, a gridiron hero at John Hughes High School sets out to turn a bespectacled plain Jane into a beautiful and popular prom queen in this outrageous send-up of the teen movies of the 1980s and '90s.;7/12/2001
Crater;6.725;Science Fiction;2023;Kyle Patrick Alvarez;images\620705.jpg;After the death of his father, a boy growing up on a lunar mining colony takes a trip to explore a legendary crater, along with his four best friends, prior to being permanently relocated to another planet.;12/05/2023
Attack on Titan II: End of the World;6.042;Horror;2015;Shinji Higuchi;images\340382.jpg;Eren Yeager leaves to restore a break in the wall destroyed by a Titan. He comes under attack by the Titans and is cornered. Shikishima comes to his aid. The titans never stops attacking.  Eren is now injured and tries to protect Armin, but is swallowed by a titan. A Titan with black hair appears and begins to expel the other titans.;1/09/2015
Wish Dragon;7.953;Animation;2021;Chris Appelhans;images\550205.jpg;Determined teen Din is longing to reconnect with his childhood best friend when he meets a wish-granting dragon who shows him the magic of possibilities.;15/01/2021
No Country for Old Men;7.937;Crime;2007;Joel Coen;images\6977.jpg;Llewelyn Moss stumbles upon dead bodies, $2 million and a hoard of heroin in a Texas desert, but methodical killer Anton Chigurh comes looking for it, with local sheriff Ed Tom Bell hot on his trail. The roles of prey and predator blur as the violent pursuit of money and justice collide.;13/06/2007
Apocalypto;7.567;Action;2006;Mel Gibson;images\1579.jpg;Set in the Mayan civilization, when a man's idyllic presence is brutally disrupted by a violent invading force, he is taken on a perilous journey to a world ruled by fear and oppression where a harrowing end awaits him. Through a twist of fate and spurred by the power of his love for his woman and his family he will make a desperate break to return home and to ultimately save his way of life.;7/12/2006
American Beauty;8;Drama;1999;Sam Mendes;images\14.jpg;Lester Burnham, a depressed suburban father in a mid-life crisis, decides to turn his hectic life around after developing an infatuation with his daughter's attractive friend.;15/09/1999
Maze Runner: The Death Cure;7.108;Science Fiction;2018;Wes Ball;images\336843.jpg;Thomas leads his group of escaped Gladers on their final and most dangerous mission yet. To save their friends, they must break into the legendary Last City, a WCKD-controlled labyrinth that may turn out to be the deadliest maze of all. Anyone who makes it out alive will get answers to the questions the Gladers have been asking since they first arrived in the maze.;10/01/2018
American Reunion;6.287;Comedy;2012;Jon Hurwitz;images\71552.jpg;The characters we met a little more than a decade ago return to East Great Falls for their high school reunion. In one long-overdue weekend, they will discover what has changed, who hasn’t, and that time and distance can’t break the bonds of friendship.;4/04/2012
Brother Bear;7.256;Adventure;2003;Aaron Blaise;images\10009.jpg;When an impulsive boy named Kenai is magically transformed into a bear, he must literally walk in another's footsteps until he learns some valuable life lessons. His courageous and often zany journey introduces him to a forest full of wildlife, including the lovable bear cub Koda, hilarious moose Rutt and Tuke, woolly mammoths and rambunctious rams.;23/10/2003
The Kissing Booth;7.228;Romance;2018;Vince Marcello;images\454983.jpg;When teenager Elle's first kiss leads to a forbidden romance with the hottest boy in high school, she risks her relationship with her best friend.;11/05/2018
Disenchanted;6.851;Comedy;2022;Adam Shankman;images\338958.jpg;Disillusioned with life in the city, feeling out of place in suburbia, and frustrated that her happily ever after hasn’t been so easy to find, Giselle turns to the magic of Andalasia for help. Accidentally transforming the entire town into a real-life fairy tale and placing her family’s future happiness in jeopardy, she must race against time to reverse the spell and determine what happily ever after truly means to her and her family.;18/11/2022
I Am Rage;6.88;Action;2023;David Ryan Keith;images\1135229.jpg;An ancient cult embroiled in a sinister blood trade makes the deadly mistake of abducting a young woman with a violent, shocking past.;14/09/2023
Beautiful Disaster;6.596;Romance;2023;Roger Kumble;images\1016121.jpg;Bad-boy Travis is exactly what college freshman Abby needs and wants to avoid. He spends his nights fighting in underground boxing matches, and his days as the ultimate college campus charmer. But Abby wants nothing to do with Travis. Intrigued by Abby’s resistance, Travis offers her a simple bet: if he loses his next fight, he must remain sex-free for a month. If he wins, Abby must live in his apartment for the same amount of time. Either way, Travis has no idea that Abby’s dark past is about to emerge, and he may have finally met his match.;4/04/2023
The Interview;6.189;Action;2014;Seth Rogen;images\228967.jpg;"Dave Skylark and his producer Aaron Rapaport run the celebrity tabloid show ""Skylark Tonight"". When they land an interview with a surprise fan, North Korean dictator Kim Jong-un, they are recruited by the CIA to turn their trip to Pyongyang into an assassination mission.";25/12/2014
Pinocchio;7.103;Animation;1940;Ben Sharpsteen;images\10895.jpg;When loving Geppetto creates a wooden puppet, his wish is granted when it comes to life as a little wooden boy named Pinocchio. With his faithful friend and conscience Jiminy Cricket by his side, Pinocchio, embarks on fantastic adventures that his bravery, loyalty and honesty until triumphs in his triumphs in his quest for his heart's desire: to become a real boy.;23/02/1940
Rocky IV;7.075;Drama;1985;Sylvester Stallone;images\1374.jpg;Rocky Balboa proudly holds the world heavyweight boxing championship, but a new challenger has stepped forward: Drago, a six-foot-four, 261-pound fighter who has the backing of the Soviet Union.;21/11/1985
97 Minutes;4.865;Action;2023;Timo Vuorensola;images\940241.jpg;A hijacked 767 will crash in just 97 minutes when its fuel runs out. Against the strong will of NSA Deputy Toyin, NSA Director Hawkins prepares to have the plane shot down before it does any catastrophic damage on the ground, leaving the fate of the innocent passengers in the hands of Tyler, one of the alleged hijackers on board who is an undercover Interpol agent - or is he?;9/06/2023
A Frozen Rooster;7.656;Animation;2022;Rodolfo Riva Palacio Alatriste;images\573171.jpg;Follow the adventures of Toto and his family, who will have to travel to the South Pole to fulfill their promise to return a polar bear and some Spanish penguins to their home. In order to fulfill the promise, they will have to overcome some obstacles that will teach them how important teamwork is.;14/12/2022
Kaguya-sama: Love Is War -The First Kiss That Never Ends-;7.944;Animation;2022;Mamoru Hatakeyama;images\997317.jpg;After pining for one another and plotting for so long, Kaguya Shinomiya and Miyuki Shirogane finally have their climactic first kiss. However, they struggle to define their relationship. After all, how much of their true selves have they really shown to one another?;17/12/2022
Babylon 5: The Road Home;6.8;Animation;2023;Matt Peters;images\1121575.jpg;Travel across the galaxy with John Sheridan as he unexpectedly finds himself transported through multiple timelines and alternate realities in a quest to find his way back home. Along the way he reunites with some familiar faces, while discovering cosmic new revelations about the history, purpose, and meaning of the Universe.;15/08/2023
SHIROBAKO The Movie;7.2;Animation;2020;Tsutomu Mizushima;images\532323.jpg;Four years after the events of SHIROBAKO the series, Musashino Animation has gone through unprecedented changes and things are looking bleak for the studio. One day, Aoi Miyamori is offered a role managing a new theatrical animation project. With only a few months left before the deadline, can MusAni complete the project in its current state? It’s up to Aoi to work alongside both familiar faces and new to finish the project in time!;29/02/2020
Pokémon the Movie: I Choose You!;7.045;Family;2017;Kunihiko Yuyama;images\436931.jpg;Ash Ketchum wakes up late one morning after having broken his alarm clock in his sleep. He eventually makes it to Professor Oak's lab, but is told that the three starter List of Pokémon (Bulbasaur, Squirtle, and Charmander) have already been taken by Trainers who were on time. However, Oak reveals that he has one more Pokémon, an Electric-type named Pikachu. Despite its volatile and feisty personality, as well as its refusal to get inside a Poké Ball, Ash happily takes Pikachu for his journey.;15/07/2017
Halloween;7.6;Horror;1978;John Carpenter;images\948.jpg;Fifteen years after murdering his sister on Halloween Night 1963, Michael Myers escapes from a mental hospital and returns to the small town of Haddonfield, Illinois to kill again.;24/10/1978
Home on the Range;6.029;Animation;2004;Will Finn;images\13700.jpg;"When a greedy outlaw schemes to take possession of the ""Patch Of Heaven"" dairy farm, three determined cows, a karate-kicking stallion and a colorful corral of critters join forces to save their home. The stakes are sky-high as this unlikely animal alliance risk their hides and match wits with a mysterious band of bad guys.";2/04/2004
Parsley;6.3;Drama;2022;José María Cabral;images\934028.jpg;"In 1937, near the border between the Dominican Republic and Haiti, a young Haitian woman named Marie is expecting her first child with Frank, her doting Dominican husband. After her mother's burial, she is awakened in the middle of the night by distant screams. The immediate execution of all Haitians on Dominican soil has been ordered — the so-called “Cut” — and what seals a victim’s fate is whether or not they can pronounce ""perejil"" (parsley). Marie takes off to find Frank in the next town over, with nothing but the clothes on her back.";6/03/2022
Love at First Sight;7.341;Romance;2023;Vanessa Caswill;images\353577.jpg;Hadley and Oliver begin falling in love on a flight from New York to London, but when they lose each other at customs, can they defy all odds to reunite?;15/09/2023
You Don't Mess with the Zohan;5.7;Comedy;2008;Dennis Dugan;images\10661.jpg;An Israeli counterterrorism soldier with a secretly fabulous ambition to become a Manhattan hairstylist. Zohan's desire runs so deep that he'll do anything -- including faking his own death and going head-to-head with an Arab cab driver -- to make his dreams come true.;5/06/2008
The Perks of Being a Wallflower;7.786;Drama;2012;Stephen Chbosky;images\84892.jpg;Pittsburgh, Pennsylvania, 1991. High school freshman Charlie is a wallflower, always watching life from the sidelines, until two senior students, Sam and her stepbrother Patrick, become his mentors, helping him discover the joys of friendship, music and love.;20/09/2012
Edge of Tomorrow;7.609;Action;2014;Doug Liman;images\137113.jpg;Major Bill Cage is an officer who has never seen a day of combat when he is unceremoniously demoted and dropped into combat. Cage is killed within minutes, managing to take an alpha alien down with him. He awakens back at the beginning of the same day and is forced to fight and die again... and again - as physical contact with the alien has thrown him into a time loop.;27/05/2014
The Raffle;6.787;Drama;1991;Francesco Laudadio;images\59053.jpg;Francesca, an incredibly beautiful woman, after the death of her husband discovers his unfaithfulness and huge amount of debts he left. Cesare is Francesca's best friend, he is a solicitor. Following his advice Francesca starts selling all her goods, like the house, jewels, furs and finally also the yacht. By doing this she is able to survive for the rest of the year, but has no prospects for the future and every attempt to get a job fails. Finally she makes a decision to set up a lottery in which the prize is her.;15/11/1991
Planet of the Apes;5.73;Thriller;2001;Tim Burton;images\869.jpg;After a spectacular crash-landing on an uncharted planet, brash astronaut Leo Davidson finds himself trapped in a savage world where talking apes dominate the human race. Desperate to find a way home, Leo must evade the invincible gorilla army led by Ruthless General Thade.;25/07/2001
The Revenant;7.528;Western;2015;Alejandro González Iñárritu;images\281957.jpg;In the 1820s, a frontiersman, Hugh Glass, sets out on a path of vengeance against those who left him for dead after a bear mauling.;25/12/2015
Wrong Turn;6.35;Horror;2003;Rob Schmidt;images\9902.jpg;Chris crashes into a carload of other young people, and the group of stranded motorists is soon lost in the woods of West Virginia, where they're hunted by three cannibalistic mountain men who are grossly disfigured by generations of inbreeding.;30/05/2003
Don't Be a Menace to South Central While Drinking Your Juice in the Hood;6.973;Comedy;1996;Paris Barclay;images\10607.jpg;When Ashtray moves to South Central L.A. to live with his father (who appears to be the same age he is) and grandmother (who likes to talk tough and smoke reefer), he falls in with his gang-banging cousin Loc Dog, who along with the requisite pistols and Uzi carries a thermo-nuclear warhead for self-defense. Will Ashtray be able to keep living the straight life?;12/01/1996
The Prestige;8.205;Drama;2006;Christopher Nolan;images\1124.jpg;A mysterious story of two magicians whose intense rivalry leads them on a life-long battle for supremacy -- full of obsession, deceit and jealousy with dangerous and deadly consequences.;19/10/2006
17 Again;6.292;Comedy;2009;Burr Steers;images\16996.jpg;"On the brink of a midlife crisis, 30-something Mike O'Donnell wishes he could have a ""do-over."" And that's exactly what he gets when he wakes up one morning to find he's 17 years old again. With his adult mind stuck inside the body of a teenager, Mike actually has the chance to reverse some decisions he wishes he'd never made. But maybe they weren't so bad after all.";11/03/2009
American Pie Presents: The Naked Mile;5.505;Comedy;2006;Joe Nussbaum;images\8275.jpg;When Erik Stifler realizes that he's the only Stifler family member who might graduate high school a virgin, he decides to live up to his legacy. After some well-meaning advice from Jim's dad, Erik's ready to take his chances at the annual and infamous Naked Mile race, where his devoted friends and some uninhibited sorority girls will create the most outrageous weekend ever.;4/12/2006
JUNG_E;6.218;Science Fiction;2023;Yeon Sang-ho;images\843794.jpg;On an uninhabitable 22nd-century Earth, the outcome of a civil war hinges on cloning the brain of an elite soldier to create a robot mercenary.;12/01/2023
Terminator 3: Rise of the Machines;6.145;Action;2003;Jonathan Mostow;images\296.jpg;It's been 10 years since John Connor saved Earth from Judgment Day, and he's now living under the radar, steering clear of using anything Skynet can trace. That is, until he encounters T-X, a robotic assassin ordered to finish what T-1000 started. Good thing Connor's former nemesis, the Terminator, is back to aid the now-adult Connor … just like he promised.;2/07/2003
Salt;6.4;Action;2010;Phillip Noyce;images\27576.jpg;"As a CIA officer, Evelyn Salt swore an oath to duty, honor and country. Her loyalty will be tested when a defector accuses her of being a Russian spy. Salt goes on the run, using all her skills and years of experience as a covert operative to elude capture. Salt's efforts to prove her innocence only serve to cast doubt on her motives, as the hunt to uncover the truth behind her identity continues and the question remains: ""Who is Salt?""";21/07/2010
Indiana Jones and the Temple of Doom;7.296;Adventure;1984;Steven Spielberg;images\87.jpg;After arriving in India, Indiana Jones is asked by a desperate village to find a mystical stone. He agrees – and stumbles upon a secret cult plotting a terrible plan in the catacombs of an ancient palace.;23/05/1984
Onward;7.722;Family;2020;Dan Scanlon;images\508439.jpg;In a suburban fantasy world, two teenage elf brothers embark on an extraordinary quest to discover if there is still a little magic left out there.;29/02/2020
Once Upon a Time in the West;8.288;Drama;1968;Sergio Leone;images\335.jpg;As the railroad builders advance unstoppably through the Arizona desert on their way to the sea, Jill arrives in the small town of Flagstone with the intention of starting a new life.;21/12/1968
The Road to El Dorado;7.245;Family;2000;Bibo Bergeron;images\10501.jpg;"After a failed swindle, two con-men end up with a map to El Dorado, the fabled ""city of gold,"" and an unintended trip to the New World.  Much to their surprise, the map does lead the pair to the mythical city, where the startled inhabitants promptly begin to worship them as gods.  The only question is, do they take the worshipful natives for all they're worth, or is there a bit more to El Dorado than riches?";31/03/2000
John Carter;6.303;Action;2012;Andrew Stanton;images\49529.jpg;John Carter is a war-weary, former military captain who's inexplicably transported to the mysterious and exotic planet of Barsoom (Mars) and reluctantly becomes embroiled in an epic conflict. It's a world on the brink of collapse, and Carter rediscovers his humanity when he realizes the survival of Barsoom and its people rests in his hands.;7/03/2012
Lady and the Tramp;7.104;Family;1955;Hamilton Luske;images\10340.jpg;Lady, a golden cocker spaniel, meets up with a mongrel dog who calls himself the Tramp. He is obviously from the wrong side of town, but happenings at Lady's home make her decide to travel with him for a while.;22/06/1955
GirlHouse;5.998;Horror;2014;Jon Knautz;images\312791.jpg;In an attempt to make some extra cash while away at College, Kylie moves into a house that streams content to an X-rated website. After a deranged fan hacks in to determine the house's location, she finds herself in a terrifying fight for her life.;16/10/2014
22 Jump Street;6.841;Crime;2014;Phil Lord;images\187017.jpg;After making their way through high school (twice), big changes are in store for officers Schmidt and Jenko when they go deep undercover at a local college. But when Jenko meets a kindred spirit on the football team, and Schmidt infiltrates the bohemian art major scene, they begin to question their partnership. Now they don't have to just crack the case - they have to figure out if they can have a mature relationship. If these two overgrown adolescents can grow from freshmen into real men, college might be the best thing that ever happened to them.;5/06/2014
Flushed Away;6.269;Adventure;2006;David Bowers;images\11619.jpg;London high-society mouse, Roddy is flushed down the toilet by Sid, a common sewer rat. Hang on for a madcap adventure deep in the sewer bowels of Ratropolis, where Roddy meets the resourceful Rita, the rodent-hating Toad and his faithful thugs, Spike and Whitey.;22/10/2006
Halloween Ends;6.2;Horror;2022;David Gordon Green;images\616820.jpg;Four years after the events of Halloween in 2018, Laurie has decided to liberate herself from fear and rage and embrace life. But when a young man is accused of killing a boy he was babysitting, it ignites a cascade of violence and terror that will force Laurie to finally confront the evil she can’t control, once and for all.;12/10/2022
Knowing;6.184;Action;2009;Alex Proyas;images\13811.jpg;"A teacher opens a time capsule that has been dug up at his son's elementary school; in it are some chilling predictions -- some that have already occurred and others that are about to -- that lead him to believe his family plays a role in the events that are about to unfold.";19/03/2009
Harry Potter 20th Anniversary: Return to Hogwarts;7.301;Documentary;2022;Eran Creevy;images\899082.jpg;An enchanting making-of story told through all-new in-depth interviews and cast conversations, inviting fans on a magical first-person journey through one of the most beloved film franchises of all time.;1/01/2022
The Secret Life of Pets 2;6.968;Adventure;2019;Chris Renaud;images\412117.jpg;Max the terrier must cope with some major life changes when his owner gets married and has a baby. When the family takes a trip to the countryside, nervous Max has numerous run-ins with canine-intolerant cows, hostile foxes and a scary turkey. Luckily for Max, he soon catches a break when he meets Rooster, a gruff farm dog who tries to cure the lovable pooch of his neuroses.;24/05/2019
Desire;5.974;Drama;2011;Laurent Bouhnik;images\86331.jpg;In a social context deteriorated by a countrywide economic crisis, the life of several people will be turned upside down after they meet Cécile, a character who symbolizes desire.;6/10/2011
50 First Dates;6.852;Comedy;2004;Peter Segal;images\1824.jpg;Henry is a player skilled at seducing women. But when this veterinarian meets Lucy, a girl with a quirky problem when it comes to total recall, he realizes it's possible to fall in love all over again…and again, and again. That's because the delightful Lucy has no short-term memory, so Henry must woo her day after day until he finally sweeps her off her feet.;13/02/2004
Aladdin;7.112;Adventure;2019;Guy Ritchie;images\420817.jpg;A kindhearted street urchin named Aladdin embarks on a magical adventure after finding a lamp that releases a wisecracking genie while a power-hungry Grand Vizier vies for the same lamp that has the power to make their deepest wishes come true.;22/05/2019
E.T. the Extra-Terrestrial;7.514;Science Fiction;1982;Steven Spielberg;images\601.jpg;An alien is left behind on Earth and saved by the 10-year-old Elliot who decides to keep him hidden in his home. While a task force hunts for the extra-terrestrial, Elliot, his brother, and his little sister Gertie form an emotional bond with their new friend, and try to help him find his way home.;11/06/1982
Sicario;7.4;Action;2015;Denis Villeneuve;images\273481.jpg;An idealistic FBI agent is enlisted by a government task force to aid in the escalating war against drugs at the border area between the U.S. and Mexico.;17/09/2015
The Protégé;6.602;Action;2021;Martin Campbell;images\645788.jpg;Rescued as a child by the legendary assassin Moody and trained in the family business, Anna is the world’s most skilled contract killer. When Moody, the man who was like a father to her and taught her everything she needs to know about trust and survival, is brutally killed, Anna vows revenge. As she becomes entangled with an enigmatic killer whose attraction to her goes way beyond cat and mouse, their confrontation turns deadly and the loose ends of a life spent killing will weave themselves ever tighter.;19/08/2021
