Oppenheimer;8.21;Drama;2023;Christopher Nolan;images\872585.jpg;The story of J. Robert Oppenheimer's role in the development of the atomic bomb during World War II.;19/07/2023
Five Nights at Freddy's;7.947;Horror;2023;Emma Tammi;images\507089.jpg;Recently fired and desperate for work, a troubled young man named Mike agrees to take a position as a night security guard at an abandoned theme restaurant: Freddy Fazbear's Pizzeria. But he soon discovers that nothing at Freddy's is what it seems.;25/10/2023
The Creator;7.129;Science Fiction;2023;Gareth Edwards;images\670292.jpg;Amid a future war between the human race and the forces of artificial intelligence, a hardened ex-special forces agent grieving the disappearance of his wife, is recruited to hunt down and kill the Creator, the elusive architect of advanced AI who has developed a mysterious weapon with the power to end the war—and mankind itself.;27/09/2023
Mission: Impossible - Dead Reckoning Part One;7.592;Action;2023;Christopher McQuarrie;images\575264.jpg;Ethan Hunt and his IMF team embark on their most dangerous mission yet: To track down a terrifying new weapon that threatens all of humanity before it falls into the wrong hands. With control of the future and the world's fate at stake and dark forces from Ethan's past closing in, a deadly race around the globe begins. Confronted by a mysterious, all-powerful enemy, Ethan must consider that nothing can matter more than his mission—not even the lives of those he cares about most.;8/07/2023
Expend4bles;6.42;Action;2023;Scott Waugh;images\299054.jpg;Armed with every weapon they can get their hands on and the skills to use them, The Expendables are the world’s last line of defense and the team that gets called when all other options are off the table. But new team members with new styles and tactics are going to give “new blood” a whole new meaning.;15/09/2023
Fast X;7.217;Action;2023;Louis Leterrier;images\385687.jpg;Over many missions and against impossible odds, Dom Toretto and his family have outsmarted, out-nerved and outdriven every foe in their path. Now, they confront the most lethal opponent they've ever faced: A terrifying threat emerging from the shadows of the past who's fueled by blood revenge, and who is determined to shatter this family and destroy everything—and everyone—that Dom loves, forever.;17/05/2023
The Equalizer 3;7.421;Action;2023;Antoine Fuqua;images\926393.jpg;Robert McCall finds himself at home in Southern Italy but he discovers his friends are under the control of local crime bosses. As events turn deadly, McCall knows what he has to do: become his friends' protector by taking on the mafia.;30/08/2023
Sound of Freedom;8.084;Action;2023;Alejandro Gómez Monteverde;images\678512.jpg;The story of Tim Ballard, a former US government agent, who quits his job in order to devote his life to rescuing children from global sex traffickers.;3/07/2023
Saw X;7.413;Horror;2023;Kevin Greutert;images\951491.jpg;Between the events of 'Saw' and 'Saw II', a sick and desperate John Kramer travels to Mexico for a risky and experimental medical procedure in hopes of a miracle cure for his cancer, only to discover the entire operation is a scam to defraud the most vulnerable. Armed with a newfound purpose, the infamous serial killer returns to his work, turning the tables on the con artists in his signature visceral way through devious, deranged, and ingenious traps.;26/09/2023
Blue Beetle;7;Action;2023;Ángel Manuel Soto;images\565770.jpg;Recent college grad Jaime Reyes returns home full of aspirations for his future, only to find that home is not quite as he left it. As he searches to find his purpose in the world, fate intervenes when Jaime unexpectedly finds himself in possession of an ancient relic of alien biotechnology: the Scarab.;16/08/2023
The Killer;6.792;Crime;2023;David Fincher;images\800158.jpg;After a fateful near-miss, an assassin battles his employers, and himself, on an international manhunt he insists isn't personal.;25/10/2023
PAW Patrol: The Mighty Movie;6.941;Animation;2023;Cal Brunker;images\893723.jpg;A magical meteor crash lands in Adventure City and gives the PAW Patrol pups superpowers, transforming them into The Mighty Pups.;21/09/2023
Meg 2: The Trench;6.761;Action;2023;Ben Wheatley;images\615656.jpg;An exploratory dive into the deepest depths of the ocean of a daring research team spirals into chaos when a malevolent mining operation threatens their mission and forces them into a high-stakes battle for survival.;2/08/2023
Pet Sematary: Bloodlines;6.14;Horror;2023;Lindsey Anderson Beer;images\830764.jpg;In 1969, a young Jud Crandall has dreams of leaving his hometown of Ludlow, Maine behind, but soon discovers sinister secrets buried within and is forced to confront a dark family history that will forever keep him connected to Ludlow.;23/09/2023
Gran Turismo;7.987;Adventure;2023;Neill Blomkamp;images\980489.jpg;The ultimate wish-fulfillment tale of a teenage Gran Turismo player whose gaming skills won him a series of Nissan competitions to become an actual professional racecar driver.;9/08/2023
The Black Book;6.544;Mystery;2023;Editi Effiong;images\1172009.jpg;After his son is wrongly accused of kidnapping, a deacon who has just lost his wife takes matters into his own hands and fights a crooked police gang to clear him.;22/09/2023
The Nun II;6.911;Horror;2023;Michael Chaves;images\968051.jpg;In 1956 France, a priest is violently murdered, and Sister Irene begins to investigate. She once again comes face-to-face with a powerful evil.;6/09/2023
Elemental;7.735;Animation;2023;Peter Sohn;images\976573.jpg;In a city where fire, water, land and air residents live together, a fiery young woman and a go-with-the-flow guy will discover something elemental: how much they have in common.;14/06/2023
Retribution;6.968;Action;2023;Nimród Antal;images\762430.jpg;When a mysterious caller puts a bomb under his car seat, Matt Turner begins a high-speed chase across the city to complete a specific series of tasks- all with his kids trapped in the back seat.;23/08/2023
Barbie;7.201;Comedy;2023;Greta Gerwig;images\346698.jpg;Barbie and Ken are having the time of their lives in the colorful and seemingly perfect world of Barbie Land. However, when they get a chance to go to the real world, they soon discover the joys and perils of living among humans.;19/07/2023
Inside Out;7.92;Animation;2015;Pete Docter;images\150540.jpg;Growing up can be a bumpy road, and it's no exception for Riley, who is uprooted from her Midwest life when her father starts a new job in San Francisco. Riley's guiding emotions— Joy, Fear, Anger, Disgust and Sadness—live in Headquarters, the control centre inside Riley's mind, where they help advise her through everyday life and tries to keep things positive, but the emotions conflict on how best to navigate a new city, house and school.;9/06/2015
Spider-Man: Across the Spider-Verse;8.406;Animation;2023;Joaquim Dos Santos;images\569094.jpg;After reuniting with Gwen Stacy, Brooklyn’s full-time, friendly neighborhood Spider-Man is catapulted across the Multiverse, where he encounters the Spider Society, a team of Spider-People charged with protecting the Multiverse’s very existence. But when the heroes clash on how to handle a new threat, Miles finds himself pitted against the other Spiders and must set out on his own to save those he loves most.;31/05/2023
Teenage Mutant Ninja Turtles: Mutant Mayhem;7.312;Animation;2023;Jeff Rowe;images\614930.jpg;After years of being sheltered from the human world, the Turtle brothers set out to win the hearts of New Yorkers and be accepted as normal teenagers through heroic acts. Their new friend April O'Neil helps them take on a mysterious crime syndicate, but they soon get in over their heads when an army of mutants is unleashed upon them.;31/07/2023
Transformers: Rise of the Beasts;7.458;Action;2023;Steven Caple Jr.;images\667538.jpg;When a new threat capable of destroying the entire planet emerges, Optimus Prime and the Autobots must team up with a powerful faction known as the Maximals. With the fate of humanity hanging in the balance, humans Noah and Elena will do whatever it takes to help the Transformers as they engage in the ultimate battle to save Earth.;6/06/2023
The Monkey King: Reborn;7.126;Animation;2021;Wang Yunfei;images\811634.jpg;When the irritable monkey king visits a temple together with his master Tang Monk, he feels offended because of a trifle and thereupon accidentally destroys a magic tree growing on the sacred ground. This brings an ancient demon king back to life, who promptly kidnaps Tang Monk to take revenge for his long imprisonment. The monkey king and his followers have only three days to not only save their master but also to prevent the demon king from regaining his full powers and destroying the world…;2/04/2021
The Super Mario Bros. Movie;7.753;Animation;2023;Michael Jelenic;images\502356.jpg;While working underground to fix a water main, Brooklyn plumbers—and brothers—Mario and Luigi are transported down a mysterious pipe and wander into a magical new world. But when the brothers are separated, Mario embarks on an epic quest to find Luigi.;5/04/2023
After Everything;7.049;Romance;2023;Castille Landon;images\820525.jpg;Besieged by writer’s block and the crushing breakup with Tessa, Hardin travels to Portugal in search of a woman he wronged in the past – and to find himself. Hoping to win back Tessa, he realizes he needs to change his ways before he can make the ultimate commitment.;13/09/2023
The Exorcist: Believer;6.15;Horror;2023;David Gordon Green;images\807172.jpg;When two girls disappear into the woods and return three days later with no memory of what happened to them, the father of one girl seeks out Chris MacNeil, who's been forever altered by what happened to her daughter fifty years ago.;4/10/2023
Megalomaniac;6.2;Horror;2023;Karim Ouelhaj;images\841742.jpg;Felix and Martha, the two offspring of legendary serial murderer The Skinner of Mons, grapple with the grotesque legacy bequeathed to them. While Martha works a menial janitorial job, Felix continues his father's reign of terror. But following a brutal attack at work, Martha quickly descends into madness, finding she must come to terms with the infamous blood that flows through her veins.;8/09/2023
Muzzle;6.676;Action;2023;John Stalberg Jr.;images\939335.jpg;LAPD K-9 officer Jake Rosser has just witnessed the shocking murder of his dedicated partner by a mysterious assailant. As he investigates the shooter’s identity, he uncovers a vast conspiracy that has a chokehold on the city in this thrilling journey through the tangled streets of Los Angeles and the corrupt bureaucracy of the LAPD.;29/09/2023
My Fault;8.098;Drama;2023;Domingo González;images\1010581.jpg;Noah must leave her city, boyfriend, and friends to move into William Leister's mansion, the flashy and wealthy husband of her mother Rafaela. As a proud and independent 17 year old, Noah resists living in a mansion surrounded by luxury. However, it is there where she meets Nick, her new stepbrother, and the clash of their strong personalities becomes evident from the very beginning.;8/06/2023
Boudica;6.222;Action;2023;Jesse V. Johnson;images\975902.jpg;Inspired by events in A.D. 60, Boudica follows the eponymous Celtic warrior who rules the Iceni people alongside her husband Prasutagus. When he dies at the hands of Roman soldiers, Boudica’s kingdom is left without a male heir and the Romans seize her land and property.  Driven to the edge of madness and determined to avenge her husband’s death, Boudica rallies the various tribes from the region and wages an epic war against the mighty Roman empire.;26/10/2023
The Baker;6.967;Action;2023;Jonathan Sobol;images\823395.jpg;A quiet, stoic man, lives a monk-like existence in self-imposed exile. When his estranged son is killed in a drug deal gone bad, he is left to look after a granddaughter he never knew existed, and he is forced back into a life he tried to put behind him.;27/07/2023
Trolls Band Together;6.5;Animation;2023;Walt Dohrn;images\901362.jpg;When Branch’s brother, Floyd, is kidnapped for his musical talents by a pair of nefarious pop-star villains, Branch and Poppy embark on a harrowing and emotional journey to reunite the other brothers and rescue Floyd from a fate even worse than pop-culture obscurity.;12/10/2023
Babylon A.D.;5.599;Action;2008;Mathieu Kassovitz;images\9381.jpg;A veteran-turned-mercenary is hired to take a young woman with a secret from post-apocalyptic Eastern Europe to New York City.;20/08/2008
Mavka: The Forest Song;7.257;Animation;2023;Oleksandra Ruban;images\459003.jpg;Forest soul Mavka faces an impossible choice between her heart and her duty as guardian to the Heart of the Forest, when she falls in love with the talented young human musician Lukas.;2/03/2023
John Wick: Chapter 4;7.796;Action;2023;Chad Stahelski;images\603692.jpg;With the price on his head ever increasing, John Wick uncovers a path to defeating The High Table. But before he can earn his freedom, Wick must face off against a new enemy with powerful alliances across the globe and forces that turn old friends into foes.;22/03/2023
One Piece: Episode of Skypiea;6.959;Animation;2018;Konosuke Uda;images\545742.jpg;One day, a giant ship falls onto the Straw Hats from the sky. After a narrow escape, and while they are still in shock, a map to the “Sky Island” is carried to them by the wind. While researching for the way there, they meet another pirate and learn that he is a descendant of an infamous Sky Island explorer who was even depicted in a picture book “Noland The Liar” four centuries ago. However, Noland was possibly not a liar after all and might actually have gone to the Sky Island.;31/12/2018
Talk to Me;7.195;Horror;2023;Michael Philippou;images\1008042.jpg;When a group of friends discover how to conjure spirits using an embalmed hand, they become hooked on the new thrill, until one of them goes too far and unleashes terrifying supernatural forces.;26/07/2023
Uri: The Surgical Strike;7.162;Action;2019;Aditya Dhar;images\554600.jpg;Following the roguish terrorist attacks at Uri Army Base camp in Kashmir, India takes the fight to the enemy, in its most successful covert operation till date with one and only one objective of avenging their fallen heroes.;11/01/2019
The Flash;6.838;Action;2023;Andy Muschietti;images\298618.jpg;When his attempt to save his family inadvertently alters the future, Barry Allen becomes trapped in a reality in which General Zod has returned and there are no Super Heroes to turn to. In order to save the world that he is in and return to the future that he knows, Barry's only hope is to race for his life. But will making the ultimate sacrifice be enough to reset the universe?;13/06/2023
Last Looks;5.919;Action;2022;Tim Kirkby;images\557946.jpg;A disgraced ex-cop seeks solace by moving to the woods, but his quiet life comes to an end when a private eye recruits him to investigate the murder of an eccentric TV star's wife.;27/01/2022
Texas Chainsaw 3D;5.458;Horror;2013;John Luessenhop;images\76617.jpg;A young woman learns that she has inherited a Texas estate from her deceased grandmother. After embarking on a road trip with friends to uncover her roots, she finds she is the sole owner of a lavish, isolated Victorian mansion. But her newfound wealth comes at a price as she stumbles upon a horror that awaits her in the mansion’s dank cellars.;3/01/2013
Nowhere;7.569;Thriller;2023;Albert Pintó;images\1151534.jpg;A young pregnant woman named Mia escapes from a country at war by hiding in a maritime container aboard a cargo ship. After a violent storm, Mia gives birth to the child while lost at sea, where she must fight to survive.;29/09/2023
Avatar: The Way of Water;7.648;Science Fiction;2022;James Cameron;images\76600.jpg;Set more than a decade after the events of the first film, learn the story of the Sully family (Jake, Neytiri, and their kids), the trouble that follows them, the lengths they go to keep each other safe, the battles they fight to stay alive, and the tragedies they endure.;14/12/2022
Space Wars: Quest for the Deepstar;3.474;Science Fiction;2023;Garo Setian;images\986210.jpg;A father and daughter team of space scavengers race against a band of evil mercenaries to reach a legendary lost freighter called the Deepstar. Along their trek through the universe, they encounter monsters, aliens, robots, and something even worse.;21/04/2023
Spider-Man: No Way Home;7.986;Action;2021;Jon Watts;images\634649.jpg;Peter Parker is unmasked and no longer able to separate his normal life from the high-stakes of being a super-hero. When he asks for help from Doctor Strange the stakes become even more dangerous, forcing him to discover what it truly means to be Spider-Man.;15/12/2021
Sentinelle;5.244;Action;2023;Hugo Benamozig;images\1000081.jpg;François Sentinelle has two lives. By day, he is the most famous cop of Réunion Island, known for his tough methods and flowery shirts, pursuing criminals in his famous yellow defender. But the rest of the time, Sentinelle is also a charming singer.;27/08/2023
Puss in Boots: The Last Wish;8.261;Adventure;2022;Joel Crawford;images\315162.jpg;Puss in Boots discovers that his passion for adventure has taken its toll: He has burned through eight of his nine lives, leaving him with only one life left. Puss sets out on an epic journey to find the mythical Last Wish and restore his nine lives.;7/12/2022
Knuckle Girl;6.5;Action;2023;Chang;images\1178734.jpg;Ran participates in a death match in order to save her missing sister Yuzuki.;25/10/2023
Thriller Night;6.945;Animation;2011;Gary Trousdale;images\118249.jpg;A Shrek parody of Michael Jackson's Thriller song and music video, with Donkey singing.;13/09/2011
Guardians of the Galaxy Vol. 3;8.009;Science Fiction;2023;James Gunn;images\447365.jpg;Peter Quill, still reeling from the loss of Gamora, must rally his team around him to defend the universe along with protecting one of their own. A mission that, if not completed successfully, could quite possibly lead to the end of the Guardians as we know them.;3/05/2023
The Little Mermaid;6.483;Adventure;2023;Rob Marshall;images\447277.jpg;The youngest of King Triton’s daughters, and the most defiant, Ariel longs to find out more about the world beyond the sea, and while visiting the surface, falls for the dashing Prince Eric. With mermaids forbidden to interact with humans, Ariel makes a deal with the evil sea witch, Ursula, which gives her a chance to experience life on land, but ultimately places her life – and her father’s crown – in jeopardy.;18/05/2023
Indiana Jones and the Dial of Destiny;6.679;Adventure;2023;James Mangold;images\335977.jpg;Finding himself in a new era, and approaching retirement, Indy wrestles with fitting into a world that seems to have outgrown him. But as the tentacles of an all-too-familiar evil return in the form of an old rival, Indy must don his hat and pick up his whip once more to make sure an ancient and powerful artifact doesn't fall into the wrong hands.;28/06/2023
Blood Punch;6.393;Horror;2014;Madellaine Paxson;images\257117.jpg;"Milton, a college dropout, was only supposed to cook meth for one day. Broken out of rehab by a brash young woman and her trigger-happy (""ex"") boyfriend and driven to a remote cabin the woods, Milton finds himself drawn into a dangerous love triangle gone haywire. The couple's deadpan half-truths spin around Milton like a song on repeat. They seem to read him like an open book, until a mysterious message opens his eyes to his cursed existence. With unlimited ammunition, any hunting tool they could desire, and an ever-growing body count, for what did Milton really sign up?";21/02/2014
The Hunger Games: Mockingjay - Part 1;6.8;Science Fiction;2014;Francis Lawrence;images\131631.jpg;Katniss Everdeen reluctantly becomes the symbol of a mass rebellion against the autocratic Capitol.;19/11/2014
Baby Assassins 2 Babies;6.8;Action;2023;Yugo Sakamoto;images\1077600.jpg;Chisato and Mahiro were banned from performing tasks because they violated the organization's rules?! Needing money to make ends meet, they resumed their days as part time workers. The two are busy working to earn money, but they suddenly encounter other assassins who are after them. What should they do if they can't reveal their identity as assassins when they are not on duty?;24/03/2023
Coco;8.2;Family;2017;Lee Unkrich;images\354912.jpg;Despite his family’s baffling generations-old ban on music, Miguel dreams of becoming an accomplished musician like his idol, Ernesto de la Cruz. Desperate to prove his talent, Miguel finds himself in the stunning and colorful Land of the Dead following a mysterious chain of events. Along the way, he meets charming trickster Hector, and together, they set off on an extraordinary journey to unlock the real story behind Miguel's family history.;27/10/2017
Meteor Storm;4.604;Science Fiction;2010;Tibor Takács;images\55241.jpg;San Francisco becomes a target for waves of destructive meteors after a rogue comet orbits around the earth... For astronomer, Michelle Young, what was meant to be a once-in-a-lifetime celestial event, soon turns into her worst nightmare as thousands of meteors break the surface of the atmosphere and bombard the city of San Francisco.;30/01/2010
Mortal Kombat Legends: Cage Match;7;Animation;2023;Ethan Spaulding;images\1034062.jpg;In 1980s Hollywood, action star Johnny Cage is looking to become an A-list actor. But when his costar, Jennifer, goes missing from set, Johnny finds himself thrust into a world filled with shadows, danger, and deceit. As he embarks on a bloody journey, Johnny quickly discovers the City of Angels has more than a few devils in its midst.;17/10/2023
Avengers: Infinity War;8.252;Adventure;2018;Anthony Russo;images\299536.jpg;As the Avengers and their allies have continued to protect the world from threats too large for any one hero to handle, a new danger has emerged from the cosmic shadows: Thanos. A despot of intergalactic infamy, his goal is to collect all six Infinity Stones, artifacts of unimaginable power, and use them to inflict his twisted will on all of reality. Everything the Avengers have fought for has led up to this moment - the fate of Earth and existence itself has never been more uncertain.;25/04/2018
Miraculous: Ladybug & Cat Noir, The Movie;7.766;Animation;2023;Jeremy Zag;images\496450.jpg;A life of an ordinary Parisian teenager Marinette goes superhuman when she becomes Ladybug. Bestowed with magical powers of creation, Ladybug must unite with her opposite, Cat Noir, to save Paris as a new villain unleashes chaos unto the city.;5/07/2023
Radical;7.273;Drama;2023;Christopher Zalla;images\1058694.jpg;In a Mexican border town plagued by neglect, corruption, and violence, a frustrated teacher tries a radical new method to break through his students’ apathy and unlock their curiosity, their potential… and maybe even their genius.;19/10/2023
Poseído;4.8;Horror;2019;Javier M. Ruiz;images\513776.jpg;Cristian is attacked by an evil entity , her mother did not know what to do , his godfather father Ernesto fought to save him and thus regain the faith of the people.;31/10/2019
Umma;5.37;Horror;2022;Iris K. Shim;images\751237.jpg;Amanda and her daughter live a quiet life on an American farm, but when the remains of her estranged mother arrive from Korea, Amanda becomes haunted by the fear of turning into her own mother.;18/03/2022
Carl's Date;7.624;Animation;2023;Bob Peterson;images\1076364.jpg;Carl Fredricksen reluctantly agrees to go on a date with a lady friend—but admittedly has no idea how dating works these days. Ever the helpful friend, Dug steps in to calm Carl's pre-date jitters and offer some tried-and-true tips for making friends—if you're a dog.;15/06/2023
57 Seconds;5.699;Thriller;2023;Rusty Cundieff;images\937249.jpg;When a tech blogger lands an interview with a tech guru and stops an attack on him, he finds a mysterious ring that takes him back 57 seconds into the past.;29/09/2023
Night Train;6.313;Action;2023;Shane Stanley;images\1007427.jpg;Mother Holly McCord is driven to extremes to save the life of her young son. Even if it means hauling black market drugs in her souped-up truck, with the Feds in hot pursuit. With two bounties on her head and her son’s life on the line, Holly climbs behind the wheel of “Night Train,” ready to outrun, out gun, and outlast them all.;13/01/2023
RDX: Robert Dony Xavier;6.88;Action;2023;Nahas Hidayath;images\997391.jpg;Once-menacing, anger fueled, trained martial arts fighters Robert, Dony and Xavier settle down to peaceful lives, after a significant event prompts them. Fate orchestrates their reunion and return from exile to their fighting ways, when their history linger ominously and one of them faces a violent attack.;25/08/2023
Agnes;4.094;Horror;2021;Mickey Reece;images\804755.jpg;Rumors of demonic possession at a religious convent prompts a church investigation into the strange goings-on among its nuns. A disaffected priest and his neophyte are confronted with temptation, bloodshed and a crisis of faith.;10/12/2021
When Evil Lurks;7.329;Horror;2023;Demián Rugna;images\744857.jpg;Residents of a small rural town discover that a demon is about to be born among them. They desperately try to escape before the evil is born, but it may be too late.;5/10/2023
Killers of the Flower Moon;7.7;Crime;2023;Martin Scorsese;images\466420.jpg;When oil is discovered in 1920s Oklahoma under Osage Nation land, the Osage people are murdered one by one—until the FBI steps in to unravel the mystery.;18/10/2023
